"A Tutorial on Environment-Aware Communications via Channel Knowledge Map for 6G","Y. Zeng; J. Chen; J. Xu; D. Wu; X. Xu; S. Jin; X. Gao; D. Gesbert; S. Cui; R. Zhang","National Mobile Communications Research Laboratory and the Frontiers Science Center for Mobile Information Communication and Security, Southeast University, Nanjing, China; School of Science and Engineering and the Future Network of Intelligence Institute, The Chinese University of Hong Kong (Shenzhen), Shenzhen, China; School of Science and Engineering and the Future Network of Intelligence Institute, The Chinese University of Hong Kong (Shenzhen), Shenzhen, China; National Mobile Communications Research Laboratory, Southeast University, Nanjing, China; National Mobile Communications Research Laboratory, Southeast University, Nanjing, China; National Mobile Communications Research Laboratory and the Frontiers Science Center for Mobile Information Communication and Security, Southeast University, Nanjing, China; National Mobile Communications Research Laboratory, Southeast University, Nanjing, China; EURECOM, Sophia Antipolis, France; School of Science and Engineering and the Future Network of Intelligence Institute, The Chinese University of Hong Kong (Shenzhen), Shenzhen, China; School of Science and Engineering, Shenzhen Research Institute of Big Data, The Chinese University of Hong Kong (Shenzhen), Shenzhen, China",IEEE Communications Surveys & Tutorials,"22 Aug 2024","2024","26","3","1478","1519","Sixth-generation (6G) mobile communication networks are expected to have dense infrastructures, large antenna size, wide bandwidth, cost-effective hardware, diversified positioning methods, and enhanced intelligence. Such trends bring both new challenges and opportunities for the practical design of 6G. On one hand, acquiring channel state information (CSI) in real time for all wireless links becomes quite challenging in 6G. On the other hand, there would be numerous data sources in 6G containing high-quality location-tagged channel data, e.g., the estimated channels or beams between base station (BS) and user equipment (UE), making it possible to better learn the local wireless environment. By exploiting this new opportunity and for tackling the CSI acquisition challenge, there is a promising paradigm shift from the conventional environment-unaware communications to the new environment-aware communications based on the novel approach of channel knowledge map (CKM). This article aims to provide a comprehensive overview on environment-aware communications enabled by CKM to fully harness its benefits for 6G. First, the basic concept of CKM is presented, followed by the comparison of CKM with various existing channel inference techniques. Next, the main techniques for CKM construction are discussed, including both environment model-free and environment model-assisted approaches. Furthermore, a general framework is presented for the utilization of CKM to achieve environment-aware communications, followed by some typical CKM-aided communication scenarios. Finally, important open problems in CKM research are highlighted and potential solutions are discussed to inspire future work.","1553-877X","","10.1109/COMST.2024.3364508","National Key Research and Development Program of China(grant numbers:2019YFB1803400,2018YFB1800800); National Natural Science Foundation of China(grant numbers:62071114,6504009712,U2001208,62171398,62293482); Fundamental Research Funds for the Central Universities(grant numbers:2242022k60004,2242022k60007); Guangdong Research Project(grant numbers:2019QN01X895,2017ZT07X152,2019CX01X104); Jiangsu Province Basic Research Project(grant numbers:BK20192002); Shenzhen Outstanding Talents Training Fund 202002; Guangdong Provincial Key Laboratory of Future Networks of Intelligence(grant numbers:2022B1212010001); Shenzhen Key Laboratory of Big Data and Artificial Intelligence(grant numbers:ZDSYS201707251409055); Key Area Research and Development Program of Guangdong Province(grant numbers:2018B030338001); ","https://ieeexplore.ieee.org/stamp/stamp.jsp?arnumber=10430216","Environment-aware communication;channel knowledge map (CKM);channel state information (CSI) acquisition;training-free communication;light-training communication","6G mobile communication;Antenna arrays;Radio frequency;Wireless communication;Artificial intelligence;Sensors;Hardware","","32","","206","IEEE","9 Feb 2024","","","IEEE","IEEE Journals"
"Intelligent Surfaces Empowered Wireless Network: Recent Advances and the Road to 6G","Q. Wu; B. Zheng; C. You; L. Zhu; K. Shen; X. Shao; W. Mei; B. Di; H. Zhang; E. Basar; L. Song; M. Di Renzo; Z. -Q. Luo; R. Zhang","Department of Electronic Engineering, Shanghai Jiao Tong University, Shanghai, China; School of Microelectronics, South China University of Technology, Guangzhou, China; Department of Electronic and Electrical Engineering, Southern University of Science and Technology (SUSTech), Shenzhen, China; Department of Electrical and Computer Engineering, National University of Singapore, Queenstown, Singapore; School of Science and Engineering, The Chinese University of Hong Kong, Shenzhen, China; Institute for Digital Communications (IDC), Friedrich-Alexander-University Erlangen-Nuremberg, Erlangen, Germany; National Key Laboratory of Wireless Communications, University of Electronic Science and Technology of China, Chengdu, China; State Key Laboratory of Advanced Optical Communication Systems and Networks, School of Electronics, Peking University, Beijing, China; State Key Laboratory of Advanced Optical Communication Systems and Networks, School of Electronics, Peking University, Beijing, China; Department of Electrical and Electronics Engineering, Communications Research and Innovation Laboratory (CoreLab), Koç University, Sariyer, Istanbul, Turkey; State Key Laboratory of Advanced Optical Communication Systems and Networks, School of Electronics, Peking University, Beijing, China; Université Paris-Saclay, CNRS, CentraleSupélec, Laboratoire des Signaux et Systèmes, Gif-sur-Yvette, France; School of Science and Engineering, The Chinese University of Hong Kong, Shenzhen, China; Department of Electrical and Computer Engineering, National University of Singapore, Queenstown, Singapore",Proceedings of the IEEE,"29 Oct 2024","2024","112","7","724","763","Intelligent surfaces (ISs) have emerged as a key technology to empower a wide range of appealing applications for wireless networks, due to their low cost, high energy efficiency, flexibility of deployment, and capability of constructing favorable wireless channels/radio environments. Moreover, the recent advent of several new IS architectures further expanded their electromagnetic functionalities from passive reflection to active amplification, simultaneous reflection, and refraction, as well as holographic beamforming. However, the research on ISs is still in rapid progress and there have been recent technological advances in ISs and their emerging applications that are worthy of a timely review. Thus, in this article, we provide a comprehensive survey on the recent development and advances of ISs-aided wireless networks. Specifically, we start with an overview on the anticipated use cases of ISs in future wireless networks such as 6G, followed by a summary of the recent standardization activities related to ISs. Then, the main design issues of the commonly adopted reflection-based IS and their state-of-the-art solutions are presented in detail, including reflection optimization, deployment, signal modulation, wireless sensing, and integrated sensing and communications. Finally, recent progress and new challenges in advanced IS architectures are discussed to inspire future research.","1558-2256","","10.1109/JPROC.2024.3397910","National Key Research and Development Program of China(grant numbers:2023YFB2905000); National Science Foundation of China(grant numbers:62371289,62331022); National Natural Science Foundation of China(grant numbers:62201214,62331022); Natural Science Foundation of Guangdong Province(grant numbers:2023A1515011753); Fundamental Research Funds for the Central Universities(grant numbers:2023ZYGXZR106); National Science Foundation of China(grant numbers:62371011,62322101,62271012,62227809); Beijing Natural Science Foundation(grant numbers:L212027,4222005); Scientific and Technological Research Council of Turkey (TUBITAK)(grant numbers:120E401); European Commission through the Horizon Europe Project titled COVER(grant numbers:101086228); Horizon Europe Project titled UNITE(grant numbers:101129618); Horizon Europe Project titled INSTINCT(grant numbers:101139161); Agence Nationale de la Recherche (ANR) through the France 2030 Project titled ANR-PEPR Networks of the Future(grant numbers:NF-PERSEUS 22-PEFT-004,NF-YACARI 22-PEFT-0005,NF-SYSTERA 22-PEFT-0006); CHIST-ERA Project titled PASSIONATE through ANR-23-CHR4-0003-01(grant numbers:CHIST-ERA-22-WAI-04); Guangdong Major Project of Basic and Applied Basic Research(grant numbers:2023B0303000001); Guangdong Provincial Key Laboratory of Big Data Computing; National Key Research and Development Project(grant numbers:2022YFA1003900); Advanced Research and Technology Innovation Centre (ARTIC) of National University of Singapore(grant numbers:R-261-518-005-720); Guangdong Provincial Key Laboratory of Big Data Computing; National Natural Science Foundation of China(grant numbers:62331022); Shenzhen Research Institute of Big Data(grant numbers:J00120230006); 2022 Stable Research Program of Higher Education of China(grant numbers:20220817144726001); Guangdong Major Project of Basic and Applied Basic Research(grant numbers:2023B0303000001); ","https://ieeexplore.ieee.org/stamp/stamp.jsp?arnumber=10555049","Active IS;deployment;holographic IS;integrated sensing and communication (ISAC);intelligent surfaces (ISs);modulation;omnidirectional IS;reflection optimization;sixth-generation (6G);wireless sensing","6G mobile communication;Wireless networks;Artificial intelligence;Antenna arrays;Reflection;Metamaterials;Array signal processing;Intelligent systems;Surface engineering;Electromagnetics;Holography;Array signal processing","","14","","313","IEEE","11 Jun 2024","","","IEEE","IEEE Journals"
"Sustainable Mobility in B5G/6G: V2X Technology Trends and Use Cases","S. Roger; C. Botella-Mascarell; D. Martín-Sacristán; D. García-Roger; J. F. Monserrat; T. Svensson","Computer Science Department, Universitat de València, Burjassot, Spain; Computer Science Department, Universitat de València, Burjassot, Spain; 5G Communications for Future Industry Verticals S.L (Fivecomm), Valencia, Spain; Computer Science Department, Universitat de València, Burjassot, Spain; ITEAM Research Institute, Universitat Politècnica de València, València, Spain; Department of Electrical Engineering, Chalmers University of Technology, Gothenburg, Sweden",IEEE Open Journal of Vehicular Technology,"28 Mar 2024","2024","5","","459","472","The concept of sustainability has been recently extended to cover economic and social factors besides the traditional environmental ones. This paper reflects on the potential of mobile communication standards towards achieving sustainable mobility, with focus on vehicular communications and use cases in smart cities scenarios. In this context, intelligent transportation systems, including connected and autonomous vehicles, will be key for developing affordable and sustainable infrastructures and services. We start by identifying three current technology trends, namely, towards climate neutral; cloudification and edge computing; and Big Data and artificial intelligence, and then we examine their capability to enable sustainable Vehicle-to-Everything (V2X) communication systems in beyond 5G and 6G networks. In the second part of the paper, a set of selected use case categories involving connected and autonomous vehicles is presented, showcasing the potential impact of the selected technology trends. Finally, a review of the estimates of the quantitative savings that could be achieved in environmental-related parameters such as energy/fuel consumption and greenhouse gas emissions is provided.","2644-1330","","10.1109/OJVT.2024.3375451","MICIU/AEI/10.13039/501100011033(grant numbers:TED2021-131003B-C21); MICIU/AEI/10.13039/501100011033; European Union NextGenerationEU/PRTR(grant numbers:CIBEST/2022/207,CIAICO/2022/179); Generalitat Valenciana of Spain; ","https://ieeexplore.ieee.org/stamp/stamp.jsp?arnumber=10465596","6G;beyond 5G;ITS;mobile communications;SDGs;Sustainability;V2X","Sustainable development;Market research;Vehicle-to-everything;6G mobile communication;Artificial intelligence;Smart cities;Clouds","","4","","66","CCBY","11 Mar 2024","","","IEEE","IEEE Journals"
"Joint Communication and Sensing for 6G - A Cross-Layer Perspective","H. Wymeersch; S. Saleh; A. Nimr; R. Halili; R. Berkvens; M. H. Moghaddam; J. M. Mateos-Ramos; A. Stavridis; S. Wänstedt; S. Barmpounakis; B. Priyanto; M. Beale; J. van de Beek; Z. Ye; M. Manalastas; A. Kousaridas; G. P. Fettweis","Chalmers University of Technology, Sweden; Chalmers University of Technology, Sweden; TU Dresden, Germany; IDLab, imec-UAntwerp, Belgium; IDLab, imec-UAntwerp, Belgium; Qamcom Research and Technology, Sweden; Chalmers University of Technology, Sweden; Ericsson Research, Sweden; Ericsson Research, Sweden; WINGS ICT Solutions, Athens, Greece; Sony Europe, Sweden; Sony Europe, Sweden; Luleâ University of Technology, Sweden; Luleâ University of Technology, Sweden; Nokia, Finland; Nokia, Germany; TU Dresden, Germany",2024 IEEE 4th International Symposium on Joint Communications & Sensing (JC&S),"3 Sep 2024","2024","","","01","06","As 6G emerges, cellular systems are envisioned to integrate sensing with communication capabilities, leading to multi-faceted communication and sensing (JCAS). This paper presents a comprehensive cross-layer overview of the Hexa-X-II project's endeavors in JCAS, aligning 6G use cases with service requirements and pinpointing distinct scenarios that bridge communication and sensing. This work relates to these scenarios through the lens of the cross-layer physical and networking domains, covering models, deployments, resource allocation, storage challenges, computational constraints, interfaces, and innovative functions.","","979-8-3503-8544-1","10.1109/JCS61227.2024.10646326","","https://ieeexplore.ieee.org/stamp/stamp.jsp?arnumber=10646326","6G;Joint Communication and Sensing;Cross-Layer Design","6G mobile communication;Bridges;Cross layer design;Computational modeling;Sensors;Resource management;Sustainable development","","3","","43","IEEE","3 Sep 2024","","","IEEE","IEEE Conferences"
"The Integrated Sensing and Communication Revolution for 6G: Vision, Techniques, and Applications","N. González-Prelcic; M. Furkan Keskin; O. Kaltiokallio; M. Valkama; D. Dardari; X. Shen; Y. Shen; M. Bayraktar; H. Wymeersch","Department of Electrical and Computer Engineering, University of California San Diego, La Jolla, CA, USA; Department of Electrical Engineering, Chalmers University of Technology, Gothenburg, Sweden; Unit of Electrical Engineering, Tampere University, Tampere, Finland; Unit of Electrical Engineering, Tampere University, Tampere, Finland; Department of Electrical, Electronic, and Information Engineering “Guglielmo Marconi,”, University of Bologna, Bologna, Italy; Department of Electronic Engineering and Beijing National Research Center for Information Science and Technology, Tsinghua University, Beijing, China; Department of Electronic Engineering and Beijing National Research Center for Information Science and Technology, Tsinghua University, Beijing, China; Department of Electrical and Computer Engineering, University of California San Diego, La Jolla, CA, USA; Department of Electrical Engineering, Chalmers University of Technology, Gothenburg, Sweden",Proceedings of the IEEE,"29 Oct 2024","2024","112","7","676","723","Future wireless networks will integrate sensing, learning, and communication to provide new services beyond communication and to become more resilient. Sensors at the network infrastructure, sensors on the user equipment (UE), and the sensing capability of the communication signal itself provide a new source of data that connects the physical and radio frequency (RF) environments. A wireless network that harnesses all these sensing data can not only enable additional sensing services but also become more resilient to channel-dependent effects such as blockage and better support adaptation in dynamic environments as networks reconfigure. In this article, we provide a vision for integrated sensing and communication (ISAC) networks and an overview of how signal processing, optimization, and machine learning (ML) techniques can be leveraged to make them a reality in the context of 6G. We also include some examples of the performance of several of these strategies when evaluated using a simulation framework based on a combination of ray-tracing measurements and mathematical models that mix the digital and physical worlds.","1558-2256","","10.1109/JPROC.2024.3397609","National Science Foundation(grant numbers:2147955); Federal Agency and Industry Partners through the Resilient and Intelligent NextG Systems (RINGS) Program; Samsung Research America; Toyota Motor North America; Vetenskapsrådet(grant numbers:VR 2022-03007); Hexa-X-II; European Union’s (EU) Horizon Europe Research and Innovation Programme(grant numbers:101095759); Academy of Finland(grant numbers:352754,359095); Business Finland through the “6G–ISAC” Project; HORIZON-JU-SNS-2022 Project TIMES(grant numbers:101096307); Italian National Recovery and Resilience Plan (NRRP) of NextGenerationEU, partnership on “Telecommunications of the Future” (Program “RESTART’); EU(grant numbers:PE00000001); National Natural Science Foundation of China(grant numbers:62271285); Shanghai AI Laboratory; ","https://ieeexplore.ieee.org/stamp/stamp.jsp?arnumber=10536135","Distributed joint sensing and communication (S&C); integrated sensing and communications (ISACs);monostatic sensing;near-field ISAC;radio positioning;radio simultaneous localization and mapping (SLAM);reconfigurable intelligent surface (RIS)-aided localization;sensing-aided communication","Sensors;6G mobile communication;Industries;Signal processing algorithms;Wireless networks;Surveys;Simultaneous localization and mapping;Radio frequency;Integrated sensing and communication;Machine learning;Optimization;Ray tracing;Mathematical models","","5","","307","IEEE","22 May 2024","","","IEEE","IEEE Journals"
"Enhancing UAV Network Efficiency through 6G+ Enabled Federated Learning Algorithms and Energy optimization Techniques","A. Andreou; C. X. Mavromoustakis; J. M. Batalla; E. Markakis; A. Bourdena; G. Mastorakis; H. Song","Department of Computer Science, University of Nicosia, Nicosia, Cyprus; Department of Computer Science, University of Nicosia, Nicosia, Cyprus; Warsaw University of Technology, Warsaw, Poland; Warsaw University of Technology, Warsaw, Poland; Department of Electrical and Computer Engineering, Hellenic Mediterranean University, Heraklion, Crete, Greece; Department of Management Science and Technology, Hellenic Mediterranean University, Agios Nikolaos, Crete, Greece; Department of Information Systems, University of Maryland, Baltimore, MD, USA",2024 International Wireless Communications and Mobile Computing (IWCMC),"17 Jul 2024","2024","","","192","197","This study presents an innovative approach to enhancing the efficiency of Unmanned Aerial Vehicles (UAV) in IoT networks. Employing UAVs as flying relays focuses on their role in data collection and support for terrestrial cellular networks. The central innovation lies in the application of Federated Learning (FL), which processes data while ensuring user privacy and reducing communication overhead. Addressing the challenge of UAVs’ limited battery life, which restricts sustained FL operations, we introduce the Enhanced UAV Network optimization Algorithm with Adaptive Spatial Play (ENUO-ASP). ENUOASP incorporates a modified Particle Swarm optimization (PSO) technique to determine optimal UAV placements, enhancing data collection by focusing on the Signal-to-Interference Ratio (SINR). Additionally, the paper utilizes the Deep Deterministic Policy Gradient (DDPG) method for dynamic resource allocation, optimizing energy consumption and reducing link latency between the UAV network and users. The findings indicate that the ENUO algorithm outperforms existing methods by achieving higher data rates and balanced SINR. Furthermore, the ASP resource allocation strategy improves FL execution, significantly lowering latency and energy use. This research contributes to the UAV-enabled communication field, offering a more efficient and performance-driven solution for advanced IoT applications.","2376-6506","979-8-3503-6126-1","10.1109/IWCMC61514.2024.10592391","Research and Development; ","https://ieeexplore.ieee.org/stamp/stamp.jsp?arnumber=10592391","UAV;deep RL;Resource Allocation;IoT;Network Coverage optimization;Federated Learning","Wireless communication;Technological innovation;Federated learning;Heuristic algorithms;Interference;Autonomous aerial vehicles;Resource management","","","","16","IEEE","17 Jul 2024","","","IEEE","IEEE Conferences"
"Data Service Maximization in Space-Air-Ground Integrated 6G Networks","N. Nway Ei; K. Kim; Y. Kyaw Tun; Z. Han; C. S. Hong","Department of Computer Science and Engineering, Kyung Hee University, Yongin, Gyeonggi, South Korea; Department of Computer Science and Engineering, Kyung Hee University, Yongin, Gyeonggi, South Korea; Department of Electronic Systems, Aalborg University, Copenhagen, Denmark; Department of Computer Science and Engineering, Kyung Hee University, Yongin, Gyeonggi, South Korea; Department of Computer Science and Engineering, Kyung Hee University, Yongin, Gyeonggi, South Korea",IEEE Communications Letters,"12 Nov 2024","2024","28","11","2598","2602","Integrating terrestrial and non-terrestrial networks has emerged as a promising paradigm to fulfill the constantly growing demand for connectivity, low transmission delay, and quality of services (QoS). This integration brings together the strengths of the reliability of terrestrial networks, broad coverage and service continuity of non-terrestrial networks like low earth orbit satellites (LEOSats), etc. In this work, we study a data service maximization problem in space-air-ground integrated network (SAGIN) where the ground base stations (GBSs) and LEOSats cooperatively serve the coexisting aerial users (AUs) and ground users (GUs). Then, by considering the spectrum scarcity, interference, and QoS requirements of the users, we jointly optimize the user association, AU’s trajectory, and power allocation. To address the formulated mixed-integer non-convex problem, we decompose it into two subproblems: 1) user association problem and 2) trajectory and power allocation problem. We formulate the user association problem as a binary integer programming problem and solve it by using the Gurobi optimizer. Meanwhile, the trajectory and power allocation problem is solved by the deep deterministic policy gradient (DDPG) method to cope with the problem’s non-convexity and dynamic network environments. Then, the two subproblems are alternately solved by the proposed block coordinate descent algorithm. By comparing with the baselines in the existing literature, extensive simulations are conducted to evaluate the performance of the proposed framework.","1558-2558","","10.1109/LCOMM.2024.3465500","Institute of Information & communications Technology Planning & Evaluation (IITP) grant funded by the Korea government (MSIT) (Evolvable Deep Learning Model Generation Platform for Edge Computing)(grant numbers:2019-0-01287); National Research Foundation of Korea (NRF) grant funded by MSIT(grant numbers:RS-2023-00207816); IITP grant funded by MSIT (Artificial Intelligence Innovation Hub)(grant numbers:2021-0-02068); IITP grant funded by MSIT(grant numbers:RS-2022-00155911); Artificial Intelligence Convergence Innovation Human Resources Development (Kyung Hee University)) and under the ITRC (Information Technology Research Center)(grant numbers:IITP-2023-RS-2023-00258649); IITP; ","https://ieeexplore.ieee.org/stamp/stamp.jsp?arnumber=10685484","Space-air-ground integrated network (SAGIN);low earth orbit satellites (LEOSats);aerial users (AUs);deep deterministic policy gradient (DDPG)","Resource management;Trajectory;Interference;Quality of service;Satellite broadcasting;Space-air-ground integrated networks;Gold","","","","13","IEEE","23 Sep 2024","","","IEEE","IEEE Journals"
