"Back Propagation Model Based Machine Learning In Feed Forward Neural Networks for 6G Communication","N. C. A. Boovarahan; T. Lakshmibai; T. DineshKumar; K. Saraswathi; K. Sugapriya; T. Sundar","Dept. of EIE, Sri Chandrasekharendra Saraswathi Viswa Mahavidyalaya, Enathur, India; Dept. of EIE, Sri Chandrasekharendra Saraswathi Viswa Mahavidyalaya, Enathur, India; Dept. of ECE, Sri Chandrasekharendra Saraswathi Viswa Mahavidyalaya, Enathur, India; Dept. of EIE, Sri Chandrasekharendra Saraswathi Viswa Mahavidyalaya, Enathur, India; Dept. of EIE, Sri Chandrasekharendra Saraswathi Viswa Mahavidyalaya, Enathur, India; Dept. of EIE, Sri Chandrasekharendra Saraswathi Viswa Mahavidyalaya, Enathur, India",2024 2nd International Conference on Self Sustainable Artificial Intelligence Systems (ICSSAS),"28 Nov 2024","2024","","","726","735","The creation and use of 6 G technologies are anticipated to heavily use machine learning. There are a number of ways that machine learning may boost 6G, even if research and standardization are still in their early phases. Real-time network resource allocation may be made more efficient by using machine learning methods. In order to ensure effective resource utilization and enhanced network performance, this also involves dynamic spectrum allocation, power regulation, and network slicing.To improve spectrum efficiency, 6G is anticipated to make use of improved beamforming techniques and huge multiple-input, multiple-output (MIMO) devices. Beamforming pattern optimization, channel condition adaptation, and capacity enhancement can all be aided by machine learning methods. To allow wise choice-making for base station installations, interference control, and user association, machine learning may be applied to the RAN. This improves network coverage, lowers latency, and improves user experience. This paper demonstrates the training of a basic feed forward neural network using the back propagation method. The network is trained by applying the back propagation technique through the execution of the train function. After making predictions on the test set using the trained network, evaluation measures like accuracy and root mean squared error (RMSE) are calculated.","","979-8-3503-6841-3","10.1109/ICSSAS64001.2024.10760539","","https://ieeexplore.ieee.org/stamp/stamp.jsp?arnumber=10760539","Back Propagation;Feed Forward;Neural Networks;Radio Access Network;Machine Learning;Mean Square Error","Backpropagation;6G mobile communication;Training;Array signal processing;Machine learning;Interference;User experience;Real-time systems;Resource management;Radio access networks","","","","42","IEEE","28 Nov 2024","","","IEEE","IEEE Conferences"
"FBMP-IDS: FL-Based Blockchain-Powered Lightweight MPC-Secured IDS for 6G Networks","S. Sakraoui; A. Ahmim; M. Derdour; M. Ahmim; S. Namane; I. Ben Dhaou","Department of Computer Science, Networks and Systems Laboratory, Badji Mokhtar–Annaba University, Annaba, Algeria; Department of Computer Science, Mohamed Cherif Messaadia University-Souk Ahras, Souk Ahras, Algeria; LIAOA Laboratory, University of Oum El Bouaghi, Oum El Bouaghi, Algeria; Department of Computer Science, Networks and Systems Laboratory, Badji Mokhtar–Annaba University, Annaba, Algeria; Department of Computer Science, Networks and Systems Laboratory, Badji Mokhtar–Annaba University, Annaba, Algeria; Department of Computer Science, Hekma School of Engineering, Computing and Design, Dar Al-Hekma University, Jeddah, Saudi Arabia",IEEE Access,"6 Aug 2024","2024","12","","105887","105905","The coming 6G wireless network is poised to achieve unprecedented data rates, latency, and integration with newer technologies like AI and IoE. On the other hand, along with this kind of growth in the AI domain and the large-scale connectivity in 6G. It is also going to raise many security concerns at the level of intrusion detection and prevention. For intrusion detection, centralized approaches won’t be able to work effectively, therefore there is an utmost need to design decentralized and privacy-preserving solutions. In this work, we propose a novel secure gradients exchange algorithm for distributed intrusion detection in 6G networks. Our method is designed to take into account the use of Federated Learning with secure multi-party computation and blockchain technology. This way ensures that the collaborating parties are able to conduct the training of intrusion detection models in a secure and collaborative manner by retaining privacy in the data. Gradient compression and adaptive secure aggregation strategies are used to further optimize communication overhead and computational complexity. Therefore, our design works in a robust and efficient manner with the high data rates and huge connectivity that 6G networks will provide. To achieve our goal, experiments using the CICIoT2023 dataset were performed, and results showed that our federated learning-based hybrid model composed of CNN1D and a multi-head attention mechanism outperformed other well-known deep learning models in terms of performance. It achieved the highest average accuracy with 79.92%, the highest average detection rate with 77.41%, and a low false alarm rate with 2.55%.","2169-3536","","10.1109/ACCESS.2024.3435920","","https://ieeexplore.ieee.org/stamp/stamp.jsp?arnumber=10614597","6G;computer security;network security;intrusion detection;IDS;blockchain;IoT;machine learning;deep learning;multi-head attention CNN;LSTM;hybrid model;anomaly detection;federated learning","6G mobile communication;Intrusion detection;Security;Accuracy;Data models;5G mobile communication;Deep learning;Computer security;Blockchains;Machine learning;Convolutional neural networks;Long short term memory;Federated learning","","","","46","CCBYNCND","30 Jul 2024","","","IEEE","IEEE Journals"
"Unsupervised Graph-based Learning Method for Sub-band Allocation in 6G Subnetworks","D. Abode; R. Adeogun; L. Salaün; R. Abreu; T. Jacobsen; G. Berardinelli","Department of Electronic Systems, Aalborg University, Denmark; Department of Electronic Systems, Aalborg University, Denmark; Nokia Bell Labs, Massy, France; Nokia, Aalborg, Denmark; Nokia, Aalborg, Denmark; Department of Electronic Systems, Aalborg University, Denmark",2024 IEEE 100th Vehicular Technology Conference (VTC2024-Fall),"28 Nov 2024","2024","","","1","6","In this paper, we present an unsupervised approach for frequency sub-band allocation in wireless networks using a graph-based learning method. We consider a scenario of dense deployment of subnetworks in the factory environment. The limited number of sub-bands must be optimally allocated to coordinate inter-subnetwork interference. Traditional iterative solutions may not scale to the large scale and density of sub-network deployment due to their execution overhead limitations. Hence, we consider a data-driven approach based on graph neural networks. We model the subnetwork deployment as an interference graph and propose an unsupervised learning approach to optimize the sub-band allocation using graph neural networks. This approach is inspired by the graph colouring heuristic and the Potts model. The numerical evaluation shows that the proposed method achieves close performance to the centralized greedy colouring sub-band allocation heuristic with lower computational time complexity. In addition, it incurs reduced signalling overhead compared to iterative optimization heuristics that require all the mutual interfering channel information. We further demonstrate that the method is robust to different network settings.","2577-2465","979-8-3315-1778-6","10.1109/VTC2024-Fall63153.2024.10757647","","https://ieeexplore.ieee.org/stamp/stamp.jsp?arnumber=10757647","Sub-band allocation;interference coordination;graph neural networks;subnetworks;6G","Vehicular and wireless technologies;Wireless networks;Interference;Graph neural networks;Numerical models;Resource management;Iterative methods;Time complexity;Unsupervised learning;Radio spectrum management","","","","15","IEEE","28 Nov 2024","","","IEEE","IEEE Conferences"
"Optimal Resource Allocation for NOMA-Assisted Backscatter Communication in 6G Internet of Vehicles Networks","V. D. Tuong; D. Kim; E. -J. Kim; J. Paek; S. Cho","School of Computer Science and Engineering, Chung-Ang University, Seoul, Republic of Korea; Department of Electronic Engineering, Dong-A University, Busan, Republic of Korea; Division of Software, Hallym University, Chuncheon, Republic of Korea; School of Computer Science and Engineering, Chung-Ang University, Seoul, Republic of Korea; School of Computer Science and Engineering, Chung-Ang University, Seoul, Republic of Korea",2024 International Conference on Information Networking (ICOIN),"3 Jul 2024","2024","","","290","294","Non-orthogonal multiple access (NOMA) is considered as an emerging technology to improve the spectral efficiency performance for 6G networks. Ambient backscatter communication (BackCom) is another promising solution owing to its advantages in increasing spectral and power efficiency. The investigation of integrating NOMA with BackCom is conducted to enhance the connectivity of the emerging 5G low-powered Internet-of-Vehicles (IoVs) and future 6G transportation systems. This study proposes an optimal resource allocation scheme for the NOMA-assisted BackCom IoV network. Specifically, multiple Road-Side Units (RSUs) are considered sending superimposed signals to the subscribed IoVs in the downlink NOMA. BackCom tags are considered to transmit data symbols to nearby IoVs by reflecting the signals of RSUs. Thus, we aim to maximize the total data rate performance of the NOMA-assisted BackCom IoV network. A joint problem that simultaneously optimizes the IoV clustering, IoV power allocation, and reflection coefficients of BackCom tags is formulated. To solve the problems efficiently, multiple subproblems are decomposed that can be solved using CVX optimization tool. To validate the performance of the proposed method, we compare it with those of state-of-the-art benchmark schemes. Numerical results will be provided to show the superiority of the proposed framework.","1976-7684","979-8-3503-3094-6","10.1109/ICOIN59985.2024.10572150","National Research Foundation of Korea; ","https://ieeexplore.ieee.org/stamp/stamp.jsp?arnumber=10572150","Backscatter communication;Internet of Vehicles;non-orthogonal multiple access;resource allocation","6G mobile communication;NOMA;Transportation;Symbols;Benchmark testing;Reflection coefficient;Resource management","","","","3","IEEE","3 Jul 2024","","","IEEE","IEEE Conferences"
"LEO Satellite Constellations with 5G and 6G Networks for Enhanced IoT and PV System Performance","A. Bostani; A. Baniamerian; A. Zaher; M. Al Shammari","College of Engineering and Applied Sciences, American University of Kuwait, Salmiya, Kuwait; NA; German International University, Egypt; Microwavesoft, Kuwait",2024 20th International Conference on the Design of Reliable Communication Networks (DRCN),"29 May 2024","2024","","","1","7","In the era of rapid technological evolution and increasing reliance on renewable energy sources, the integration of Low Earth Orbit (LEO) satellite constellations with emerging 5G and 6G terrestrial networks represents a critical advancement for global connectivity and remote monitoring applications. This paper extends previous analyses by incorporating a novel case study on photovoltaic (PV) system monitoring, demonstrating how satellite-enhanced communication networks can significantly improve fault diagnosis and system reliability in remote settings. By integrating advanced LEO satellites, as developed by initiatives like Starlink and OneWeb, with the latest terrestrial communication technologies, this study explores the dual application of enhanced IoT performance and proactive PV system monitoring. The convergence of these technologies addresses critical issues such as L-band saturation and provides a robust solution to connectivity challenges in underserved and geographically isolated regions. Through comprehensive simulations and a detailed case study, this paper highlights the synergistic potential of satellite and terrestrial network integration, proposing a framework that leverages high-speed satellite capabilities with the ubiquitous coverage of 5G and 6G networks. This integration not only enhances bandwidth and connectivity but also introduces significant improvements in reliability and latency for remote monitoring systems, setting a foundational strategy for future global communications infrastructure.","2766-3647","979-8-3503-4897-2","10.1109/DRCN60692.2024.10539143","","https://ieeexplore.ieee.org/stamp/stamp.jsp?arnumber=10539143","5G Networks;6G Networks;LEO Constellation;Network Convergence;IoT Connectivity;Photovoltaic System Monitoring;Remote Monitoring;Satellite Communication;Renewable Energy Systems","6G mobile communication;Satellite constellations;Technological innovation;Satellites;5G mobile communication;Low earth orbit satellites;Terrestrial communications;Security;Communication networks;Remote monitoring","","","","17","IEEE","29 May 2024","","","IEEE","IEEE Conferences"
"Revamping the Resilience and High Availability of 5G Core for 6G Ready Network Slices","S. Vittal; S. Sarkar; A. A. Franklin","Department of Computer Science and Engineering, Indian Institute of Technology Hyderabad, Hyderabad, India; Department of Computer Science and Engineering, Indian Institute of Technology Hyderabad, Hyderabad, India; Department of Computer Science and Engineering, Indian Institute of Technology Hyderabad, Hyderabad, India",IEEE Transactions on Network and Service Management,"15 Apr 2024","2024","21","2","2287","2302","Current advancements in the design of the service-based architecture of 5G Core (5GC) are flexible to be deployed with Network Function Virtualization (NFV) in the form of network slices. While some slices tolerate the delay and some do not, this versatility of slice services imposes challenges to Mobile Network Operators in designing a robust, scalable, and yet resilient 5GC. Therefore, in this work, we build a self-resilient 5GC that not only addresses the scheduling requirements per slice type but also yields service satisfaction. Precisely, we build it as a combination of large Integer Linear Programming based Column Generation (CG) and Artificial Intelligence based Deep Learning in a Closed Loop Automation with a Self Organizing Network paradigm. During unexpected situations of overload and failures of serving instances, the proposed CG technique in the work improves the scheduling and serving of control plane user requests by dropping 15% lesser user requests in delay-tolerant slices and 5% lesser in delay-sensitive slices, than the existing state-of-the-art solutions. With 95% learning accuracy, the Deep Learning-based Long Short Term Memory (LSTM) method predicts the availability of serving instances of the Network Functions (NFs) of the 5GC. Overall, by deriving the optimal number of serving instances for each NF of the 5GC, this blend of CG and AI in the 5GC not only contributes to efficient scaling and reconfiguration of the slices but also improves the resilience and High Availability of the 5GC. We believe that this proposed work is a highly promising solution for building Cognitive Autonomous Networks (CAN) of core side slices for upcoming Beyond 5G (B5G) and 6G in both cloud and edge deployments.","1932-4537","","10.1109/TNSM.2023.3348137","","https://ieeexplore.ieee.org/stamp/stamp.jsp?arnumber=10376225","5G core;network slicing;integer linear programming;column generation;deep learning;long short term memory;resilience;high availability;network function virtualization (NFV);cognitive autonomous networks (CAN)","5G mobile communication;Resilience;Noise measurement;Long short term memory;Artificial intelligence;Network function virtualization;Ultra reliable low latency communication","","","","61","IEEE","29 Dec 2023","","","IEEE","IEEE Journals"
"Efficient Dynamic Distributed Resource Slicing in 6G Multi-Access Edge Computing Networks With Online ADMM and Message Passing Graph Neural Networks","A. Asheralieva; D. Niyato; Y. Miyanaga","Department of Computer Science and Engineering and Research Institute of Trustworthy Autonomous Systems, Southern University of Science and Technology, Shenzhen, Guangdong, China; School of Computer Science and Engineering, Nanyang Technological University, Singapore; Graduate School of Science and Engineering, Chitose Institute of Science and Technology, Chitose, Hokkaido, Japan",IEEE Transactions on Mobile Computing,"7 Mar 2024","2024","23","4","2614","2638","We consider the problem of resource slicing in the 6th generation multi-access edge computing (6G-MEC) network. The network includes many non-stationary space-air-ground-sea nodes with dynamic, unstable connections and resources, where any node can be in one of two hidden states: i) reliable – when the node generates/propagates no data errors; ii) unreliable – when the node can generate/propagate random errors. We show that solving this problem is challenging, since it represents a non-deterministic polynomial-time (NP) hard dynamic combinatorial optimization problem depending on the unknown distribution of hidden nodes’ states and time-varying parameters (connections and resources of nodes) which can only be observed locally. To tackle these challenges, we develop a new deep learning (DL) model based on the message passing graph neural network (MPNN) to estimate hidden nodes’ states in dynamic network environments. We then propose a novel algorithm based on the integration of MPNN-based DL and online alternating direction method of multipliers (ADMM) – extension of the well-known classical “static” ADMM to dynamic settings, where the slicing problem is solved distributedly, in real time, based on local information. We prove that our algorithm converges to a global optimum of our problem with a superior performance even in the highly-dynamic, unreliable scenarios.","1558-0660","","10.1109/TMC.2023.3262514","Department of Education of Guangdong Province(grant numbers:2021KTSCX110); National Research Foundation; Singapore and Infocomm Media Development Authority; Future Communications Research Development; DSO National Laboratories; AI Singapore; AISG(grant numbers:AISG2-RP-2020-019); Energy Research Test-Bed and Industry Partnership Funding Initiative; DesCartes and the Campus for Research Excellence and Technological Enterprise; Ministry of Education, Culture, Sports, Science and Technology; Grant-in-Aid for Scientific Research(grant numbers:18H03212); ","https://ieeexplore.ieee.org/stamp/stamp.jsp?arnumber=10083276","6G;deep learning;dynamic combinatorial optimization;graph neural networks;graph theory;mathematical decomposi-tion;multi-access edge computing;network slicing;space-air-ground-sea networks;ultra-reliable low-latency communi-cations","6G mobile communication;Reliability;Heuristic algorithms;Dynamic scheduling;Optimization;Network topology;Quality of service","","8","","114","IEEE","28 Mar 2023","","","IEEE","IEEE Journals"
"Wireless Network Digital Twin for 6G: Generative AI as a Key Enabler","Z. Tao; W. Xu; Y. Huang; X. Wang; X. You","Southeast University, China; Southeast University, China; Southeast University, China; China Mobile, China; Southeast University, China",IEEE Wireless Communications,"7 Aug 2024","2024","31","4","24","31","Digital twin, which enables emulation, evaluation, and optimization of physical entities through synchronized digital replicas, has gained increasing attention as a promising technology for intricate wireless networks. For 6G, numerous innovative wireless technologies and network architectures have posed new challenges in establishing wireless network digital twins. To tackle these challenges, artificial intelligence (AI), particularly the flourishing generative AI, emerges as a potential solution. In this article, we discuss emerging prerequisites for wireless network digital twins, considering the complicated network architecture, tremendous network scale, extensive coverage, and diversified application scenarios in the 6G era. We further explore the applications of generative AI, such as transformer and diffusion models, to empower the 6G digital twin from multiple perspectives, including physical-digital modeling, synchronization, and slicing capability. Subsequently, we propose a hierarchical generative AI-enabled wireless network digital twin at both the message-level and policy-level, and provide a typical use case with numerical results to validate effectiveness and efficiency. Finally, open research issues for wireless network digital twins in the 6G era are discussed.","1558-0687","","10.1109/MWC.002.2300564","National Key Research and Development Program(grant numbers:2020YFB1806608); ","https://ieeexplore.ieee.org/stamp/stamp.jsp?arnumber=10628026","","6G mobile communication;Generative AI;Wireless networks;Emulation;Network architecture;Transformers;Digital twins","","5","","15","IEEE","7 Aug 2024","","","IEEE","IEEE Magazines"
"Digi-Infrastructure: Digital Twin-Enabled Traffic Shaping with Low-Latency for 6G Smart Cities","Y. Yigit; H. Ahmadi; G. Yurdakul; B. Canberk; T. Hoang; T. Q. Duong","Edinburgh Napier University, UK; University of York, UK; BTS Group, Turkey; School of Computing Engineering and the Built Environment, Edinburgh Napier University, UK; HoChiMinh City University of Technology (HCMUT)-Viet Nam National University-HoChiMinh (VNU HCM), Viet Nam; Memorial University, Canada",IEEE Communications Standards Magazine,"5 Sep 2024","2024","8","3","28","34","Digital twin (DT)-based smart cities are anticipated to achieve seamless integration between physical and digital objects to satisfy an enormous number of users across all domains. Therefore, the infrastructure of 6G smart cities has become an important topic. Many types and data priorities exist in 6G smart cities; therefore, data traffic management is challenging. Current solutions may face challenges adjusting to swiftly evolving network circumstances and the unexpected rise of time-sensitive data. They require flexibility to handle non-periodic, unforeseen, and time-sensitive traffic, such as mission-critical applications. While current research explores the combination of Time-Sensitive Networking (TSN) and 5G, the evolution to 6G also necessitates the integration of TSN and DT technology to achieve deterministic networking. Therefore, taking advantage of DT in data traffic management, we propose a DT-enabled traffic shaping architecture called Digi-infrastructure, consisting of an intelligent traffic shaper inspired by TSN. Our proposed shaper comprises two components: the first component is a frame classification method established on Deep Reinforcement Learning (DRL) to address the dynamic scheduling problem by minimising the end-to-end delay. The second component is an intelligent gate control mechanism that considers the time, queue status and specified transmission time of traffic classes according to priority based on latency requirements without using a gate control list or timing data gate control. Finally, our solution improves infrastructure connectivity, efficiency, and latency.","2471-2833","","10.1109/MCOMSTD.0002.2300027","","https://ieeexplore.ieee.org/stamp/stamp.jsp?arnumber=10666454","","6G mobile communication;Smart cities;Mission critical systems;Packet loss;Logic gates;Dynamic scheduling;Delays;Digital systems;Telecommunication traffic","","2","","15","IEEE","5 Sep 2024","","","IEEE","IEEE Magazines"
