"Dynamic Fine-Grained SLA Management for 6G eMBB-Plus Slice Using mDNN & Smart Contracts","S. Bukhari; K. Sharif; L. Zhu; C. Xu; F. Li; S. Biswas","School of Computer Science and Technology, Beijing Institute of Technology, Beijing, China; School of Computer Science and Technology, Beijing Institute of Technology, Beijing, China; School of Cyberspace Science and Technology, Beijing Institute of Technology, Beijing, China; School of Cyberspace Science and Technology, Beijing Institute of Technology, Beijing, China; School of Computer Science and Technology, Beijing Institute of Technology, Beijing, China; School of Science and Technology, CITY, University of London, London, U.K.",IEEE Transactions on Services Computing,"31 Dec 2024","2024","17","6","3499","3512","The advent of 6G networks promises revolutionary advances in dynamism, intelligence, and decentralization. Realizing the full potential of 6G requires adaptable service level agreements (SLAs) that can optimize performance based on dynamic network conditions. In this paper, we suggested a method based on the Hyperledger Sawtooth blockchain’s smart contract with the Reptile meta-learning algorithm to solve the rigidity of static SLA and centralization problems. In order to sustain the quality of service in the radio access network and core network domain of 6G networks, this work focuses on SLA management for efficient resource allocation for the eMBB-plus slice. Our approach entails breaking down static SLAs into finer-grained components, transferring those components onto Hyperledger Sawtooth smart contracts, and using the Reptile meta-learning algorithm to forecast SLA metrics and resource requirements. A dynamic tariff model, also proposed within the smart contract, handles increased user demands. We evaluate the solution by analyzing Reptile performance, resource allocation, and SLA violations under dynamic demands. Results demonstrate the efficiency of this AI-driven, blockchain-based approach for automated, optimized 6G eMBB-plus resource management adhering to dynamic fine-grained SLAs. This work highlights the synergistic potential of AI and blockchain for trusted and intelligent 6G service delivery.","1939-1374","","10.1109/TSC.2024.3453709","Beijing Natural Science Foundation(grant numbers:IS23056); National Natural Science Foundation of China(grant numbers:62232002); ","https://ieeexplore.ieee.org/stamp/stamp.jsp?arnumber=10663940","6G;blockchain;EMBB- plus;network slicing;SLA management;smart contracts","6G mobile communication;Service level agreements;Blockchains;Resource management;Dynamic scheduling;Vehicle dynamics;Artificial intelligence","","","","42","IEEE","3 Sep 2024","","","IEEE","IEEE Journals"
"Blockchain-Empowered Multi-Domain Resource Trading in TN-NTN 6G Networks: A Hierarchical Multi-Agent DRL Approach","A. M. Seid; H. N. Abishu; R. S. Rathore; A. Erbad; R. H. Jhaveri; J. Lu","College of Science and Engineering, Hamad Bin Khalifa University, Doha, Qatar; College of Science and Engineering, Hamad Bin Khalifa University, Doha, Qatar; Cardiff School of Technologies, Cardiff Metropolitan University, United Kingdom; College of Engineering, Qatar University, Doha, Qatar; School of Technology, Department of Computer Science and Engineering, Pandit Deendayal Energy University, India; Computer Science and Technology, WUST, United States",IEEE Transactions on Consumer Electronics,"","2024","PP","99","1","1","The advent of 6G networks promises transformative advances in communication technologies, ushering in an era of unprecedented connectivity, low-latency communication, and ubiquitous computing. However, one of the key challenges in realizing the full potential of 6G lies in efficiently managing and trading resources across diverse domains in terrestrial and non-terrestrial integrated networks (TN-NTN). In this paper, we introduce a novel multi-domain resource trading approach that integrates blockchain technology, hierarchical multi-agent deep reinforcement learning (HMADRL), and multi-leader multi-follower (MLMF) Stackelberg games to address this challenge. HMADRL provides an intelligent and adaptable framework for resource requesters and provider agents to learn optimal resource allocation methods in multiple domains. The MLMF Stackelberg game framework represents the strategic interactions between virtual service providers (SPs), network operators, and computing resource providers to enable them to make dynamic resource allocation and pricing decisions. This hierarchical decision-making strategy ensures a structured bargaining mechanism where leaders optimize their revenue by setting resource pricing and followers strategically decide on their resource-buying strategies. In the proposed scheme, the blockchain includes smart contracts that autonomously execute resource trading agreements, ensuring that transactions are tamper-proof and executed according to predefined rules. The proposed method optimizes the system’s utility by dynamically adjusting the pricing strategy to changing resource demands. The simulation results show that our proposed HMADRL algorithm increases the utility by 19.645%, 33.018%, and 48.791% compared to the modified multi-agent deep deterministic policy gradient (MADDPG), MADDPG, and DDPG algorithms, respectively.","1558-4127","","10.1109/TCE.2024.3512581","","https://ieeexplore.ieee.org/stamp/stamp.jsp?arnumber=10783015","Aerial-MEC;consortium blockchain;HMADRL;Metaverse;network slicing;resource trading;Stackelberg game;TN-NTN","Resource management;Blockchains;6G mobile communication;Games;Consumer electronics;Dynamic scheduling;Vehicle dynamics;Security;Artificial intelligence;Computer architecture","","","","","IEEE","9 Dec 2024","","","IEEE","IEEE Early Access Articles"
"Deep Reinforcement Learning-Based Computation Offloading for Mobile Edge Computing in 6G","H. Sun; J. Wang; D. Yong; M. Qin; N. Zhang","School of Computer Science and Technology, Southwest University of Science and Technology, Mianyang, China; School of Computer Science and Technology, Southwest University of Science and Technology, Mianyang, China; School of Computer Science and Technology, University of Science and Technology of China, Hefei, China; School of Information Engineering, Southwest University of Science and Technology, Mianyang, China; Department of Electrical and Computer Engineering, University of Windsor, Windsor, ON, Canada",IEEE Transactions on Consumer Electronics,"3 Jan 2025","2024","70","4","7482","7493","The impending 6G network is envisioned to seamlessly interconnect a myriad of consumer electronics (CEs), facilitating a wide array of applications accessible from any location and at any time. To advance this objective, our paper proposes the integration of Mobile Edge Computing (MEC) with a multi-rotor Unmanned Aerial Vehicle (UAV), aiming to furnish computation offloading services for CEs of Ground Devices (GDs). Additionally, charging stations (CSs) are utilized to wirelessly charge the UAVs. Our objective is to minimize the UAV’s energy consumption for the entire mission by jointly optimizing both resource allocation and the UAV’s trajectory simultaneously. This entails solving a mixed-integer nonlinear programming (MINLP) optimization problem. Initially, we decompose the UAV’s trajectory into discrete offloading and charging locations, guided by a decision matrix. we decompose the optimization problem into two sub-problems. The first one determines offloading locations and resource allocation using Particle Swarm Optimization (PSO). The second one optimizes the decision matrix by incorporating PSO outputs and employing Double Deep Q-Network (DDQN), a form of deep reinforcement learning. Simulation results demonstrate that the proposed solution significantly reduces energy consumption compared to baseline schemes.","1558-4127","","10.1109/TCE.2024.3436824","National Natural Science Foundation of China (NSFC)(grant numbers:62261051); ","https://ieeexplore.ieee.org/stamp/stamp.jsp?arnumber=10620315","Mobile edge computing;computation offloading;resource allocation;trajectory optimization;deep reinforcement learning","Autonomous aerial vehicles;Energy consumption;Task analysis;Resource management;Consumer electronics;Servers;Batteries","","2","","39","IEEE","1 Aug 2024","","","IEEE","IEEE Journals"
"Optimization for 6G Wireless Communications with Heterogeneous VR and Non-VR 360-Degree Videos: A Differentiated Reinforcement Learning Approach","W. Yu; J. Zhao","Graduate College, Nanyang Technological University (NTU), Singapore; College of Computing and Data Science (CCDS), Nanyang Technological University (NTU), Singapore",IEEE Transactions on Wireless Communications,"","2024","PP","99","1","1","Virtual Reality (VR) and its reliance on 360° videos are pivotal in delivering a seamless, immersive experience. In the era of emerging 6G technology, where diverse mobile devices are increasingly prevalent, optimizing Quality of Experience (QoE) becomes critical. This is especially true in applications that integrate both VR and non-VR modes. The focus on 6G highlights its capacity to cater to these varying requirements, ensuring high-quality video transmission across different platforms and user experiences. This paper introduces two novel algorithms: Separated Input Differentiated Output (SIDO) and Merged Input Differentiated Output (MIDO). These algorithms are designed to optimize resolution and power allocations in downlink wireless communication, catering to both non-VR and VR users within a chunk-based structure. By encapsulating diverse parameters like subjective perceptual video quality, chunk success rate, and cybersickness into our comprehensive QoE model, we present an approach to address challenges inherent to 360° video optimization. Our deep reinforcement learning algorithms, SIDO and MIDO, further refine the optimization process. Extensive experiments reveal the efficacy of our methodologies. This work, at its core, aims to bridge the gap between technical optimization and user experience, ensuring seamless integration of users.","1558-2248","","10.1109/TWC.2024.3409669","","https://ieeexplore.ieee.org/stamp/stamp.jsp?arnumber=10570236","Resource allocation;reinforcement learning;wireless networks;Quality of Experience;virtual reality","Videos;Quality of experience;Optimization;Resource management;Wireless communication;Cybersickness;Quality assessment","","1","","","IEEE","24 Jun 2024","","","IEEE","IEEE Early Access Articles"
"Enabling 6G Applications in the Sky: Aeronautical Federation Framework","A. Papa; J. von Mankowski; H. Vijayaraghavan; B. Mafakheri; L. Goratti; W. Kellerer","Chair of Communication Networks, Technical University of Munich, Munich, Germany; Chair of Communication Networks, Technical University of Munich, Munich, Germany; Chair of Communication Networks, Technical University of Munich, Munich, Germany; Safran Passenger Innovations, Weßling, Germany; Safran Passenger Innovations, Weßling, Germany; Chair of Communication Networks, Technical University of Munich, Munich, Germany",IEEE Network,"19 Apr 2024","2024","38","1","254","261","While the current deployment of 5G is concentrated on high-quality service delivery on a two-dimensional terrestrial area covering our planet’s surface, ongoing 5G standardization already addresses parts of the third dimension with 5G Non Terrestrial Networks (5G-NTN). 6G is expected to further leverage aeronautical communication towards a full exploration and comprehensive unification of all three dimensions. In this way, future communication systems will not only encompass all kinds of aeronautical platforms such as satellites, High-Altitude Platforms (HAPs), civil aircrafts, (self-)flying taxis, and UAVs but shall also enable the unification of terrestrial and non-terrestrial networks on a service platform level. This is further challenging, due to the rather closed aeronautical systems so far. We believe that emerging technology concepts such as Mobile Edge Computing (MEC) and Software-Defined Networking (SDN) can provide a basis for the full integration of aeronautical systems into their terrestrial counterpart. However, these technologies render the management and orchestration of aeronautical systems complex. As a step towards the integration of aeronautical communication and services into 6G, we propose a framework for the collection, monitoring, and distribution of resources in the sky among heterogeneous flying objects. This enables high-performance services for a new era of 6G aeronautical applications. Based on our proposed Aeronautical Federation Framework, we introduce emerging application use cases including aeronautical edge computing, aeronautical sensor networks, and aircraft cabin networks. In turn, we derive research challenges for 6G aeronautical networks.","1558-156X","","10.1109/MNET.132.2200526","","https://ieeexplore.ieee.org/stamp/stamp.jsp?arnumber=10061632","","6G mobile communication;Satellite broadcasting;Aircraft;5G mobile communication;Resource management;Wireless networks;Servers;Aerospace engineering","","5","","15","IEEE","7 Mar 2023","","","IEEE","IEEE Magazines"
"The Journey Toward 6G: A Digital and Societal Revolution in the Making","L. Mohjazi; B. Selim; M. Tatipamula; M. A. Imran","University of Glasgow, UK; École de Technologie Supérieure, Canada; Ericsson Silicon Valley, USA; University of Glasgow, UK",IEEE Internet of Things Magazine,"12 Mar 2024","2024","7","2","119","128","While the fifth-generation (5G) is bringing an innovative fabric of breakthrough technologies, enabling smart factories, cities, and Internet-of-Things (IoT), the unprecedented strain on communication networks put by these applications, in terms of highly cognitive, agile architectures and the support of massive connectivity, energy efficiency, and extreme ultra-low latency, is pushing 5G to their limits. As such, the focus of academic and industrial efforts has shifted toward beyond 5G (B5G) and the conceptualization of sixth-generation (6G) systems. This article discusses four main digital and societal use cases (UCs) that will drive the need to reconcile a new breed of network requirements. Based on this, we provide our vision of the fundamental architectural ingredients that will enable the promise of 6G networks of bringing the unification of experiences across the digital, physical, and human worlds. We outline key disruptive technological paradigms that will support 6G materialize a bouquet of unique expectations and redefine how we live and protect our planet. Finally, we adopt the recently envisaged ecosystem of the Internet-of-Musical Things (IoMusT) to depict how the discussed UCs and technological paradigms may be exploited to realize this ecosystem.","2576-3199","","10.1109/IOTM.001.2300119","","https://ieeexplore.ieee.org/stamp/stamp.jsp?arnumber=10463686","","5G mobile communication;6G mobile communication;Ecosystems;Urban areas;Smart manufacturing;Energy efficiency;Digital systems;Social factors;Disruptive technologies;Music","","13","","15","IEEE","12 Mar 2024","","","IEEE","IEEE Magazines"
"Toward Efficient 6G IoT Networks: A Perspective on Resource Optimization Strategies, Challenges, and Future Directions","Z. Liwen; F. Qamar; M. Liaqat; M. Nour Hindia; K. Akram Zainol Ariffin","Center of Cyber Security, Faculty of Information Science and Technology, Universiti Kebangsaan Malaysia (UKM), Bangi, Selangor, Malaysia; Center of Cyber Security, Faculty of Information Science and Technology, Universiti Kebangsaan Malaysia (UKM), Bangi, Selangor, Malaysia; Department of Electrical Engineering, College of Electrical and Mechanical Engineering, NUST, Rawalpindi, Pakistan; Department of Electrical Engineering, Faculty of Engineering, Centre of Advanced Communication, Research and Innovation (ACRI), University of Malaya, Kuala Lumpur, Malaysia; Center of Cyber Security, Faculty of Information Science and Technology, Universiti Kebangsaan Malaysia (UKM), Bangi, Selangor, Malaysia",IEEE Access,"3 Jun 2024","2024","12","","76606","76633","The next generation (6G) wireless communication technology has super advantages in high transmission rates scenarios. Internet of Things (IoT) has been applied in recent years due to its wide connection. However, effective resource optimization methods must be analyzed to meet the high requirements of key performance indicators in 6G wireless IoT networks. This paper discusses a general investigation of the resource optimization strategies in the 6G IoT system. The study aims to find the main solutions to optimize 6G IoT network performance. First, an overall summary of current research is preferred resource optimization in latency, reliability, Energy Efficiency (EE), Spectrum Efficiency (SE), bandwidth utilization efficiency, rate, and power efficiency. Second, we propose the multi-indicator tradeoff strategies associated with the latest resource optimization approaches and investigate optimal strategies. Furthermore, we show the limitations of the current resource optimization methods and discuss the future works of resource optimization for IoT devices in 6G communication. Our survey aims to help researchers optimize 6G IoT network performance using advanced techniques.","2169-3536","","10.1109/ACCESS.2024.3405487","Universiti Kebangsaan Malaysia Fundamental Research Grant Scheme from the Ministry of Higher Education(grant numbers:FRGS/1/2023/ICT07/UKM/02/1,FRGS/1/2022/ICT11/UKM/02/1); ","https://ieeexplore.ieee.org/stamp/stamp.jsp?arnumber=10539120","6G;5G;IoT;resource optimization;optimization strategies","Optimization;Internet of Things;6G mobile communication;5G mobile communication;Surveys;Artificial intelligence;Wireless communication;Resource management;Optimization methods","","2","","151","CCBYNCND","27 May 2024","","","IEEE","IEEE Journals"
"Network Selection and Resource Allocation for Coexistence of eMBB and URLLC Services in a 6G Multi-Band HetNet","E. Ataeebojd; M. Rasti; M. Latva-aho","Centre of Wireless Communications (CWC), University of Oulu, Oulu, Finland; Centre of Wireless Communications (CWC) and the Water, Energy, and Environmental Engineering research unit, University of Oulu, Oulu, Finland; Centre of Wireless Communications (CWC), University of Oulu, Oulu, Finland",IEEE Transactions on Green Communications and Networking,"","2024","PP","99","1","1","In this paper, we study the energy-efficient joint network selection, sub-carrier allocation, and power control (EEJNSAPC) problem for the coexistence of enhanced mobile broadband (eMBB) and ultra-reliable low latency (URLLC) services in a shared 6G multi-band HetNet. To support such heterogeneous services, mobile network operators (MNOs) utilize a network sharing configuration known as the multi-operator core network that allows MNOs to share their radio access networks and spectrum resources. The goal is to ensure the minimum data rate requirement for eMBB users and guarantee the delay and reliability requirements for URLLC users. Also, leveraging stochastic geometry, a statistical quality of service analysis is provided for eMBB and URLLC users. Since the EEJNSAPC problem is a mixed-integer non-convex programming problem, it is challenging to be solved directly. Therefore, we propose a hybrid deep reinforcement learning (HDRL-EEJNSAPC) algorithm composed of a double dueling deep Q-network and a soft actor-critic to solve the EEJNSAPC problem. The simulation results reveal the performance of the HDRL-EEJNSAPC algorithm in terms of energy efficiency. Also, the superiority of HDRL-EEJNSAPC over reinforcement learning approaches is demonstrated via simulation results. Besides, simulation results confirm that HDRL-EEJNSAPC obtains performance close to optimal.","2473-2400","","10.1109/TGCN.2024.3481281","","https://ieeexplore.ieee.org/stamp/stamp.jsp?arnumber=10716774","eMBB;URLLC;hybrid deep reinforcement learning;network selection;resource allocation;stochastic geometry","Ultra reliable low latency communication;Resource management;Millimeter wave communication;6G mobile communication;Interference;Terahertz communications;Reliability;Power control;Energy efficiency;Quality of service","","","","","CCBY","15 Oct 2024","","","IEEE","IEEE Early Access Articles"
"Sub-6G Aided Millimeter Wave Hybrid Beamforming: A Two-Stage Deep Learning Framework With Statistical Channel Information","S. Lv; X. Li; J. Liu; M. Shi","School of Telecommunication Engineering, Xidian University, Xi’an, Shaanxi, China; School of Telecommunication Engineering, Xidian University, Xi’an, Shaanxi, China; School of Telecommunication Engineering, Xidian University, Xi’an, Shaanxi, China; School of Telecommunication Engineering, Xidian University, Xi’an, Shaanxi, China",IEEE Transactions on Green Communications and Networking,"28 Aug 2024","2024","8","3","1245","1258","This paper focuses on a deep learning (DL) framework for the Sub-6G aided millimeter-wave (mmWave) communication system, aiming to reduce the overhead of mmWave systems. The proposed framework consists of two-stage cascaded networks, named HestNet and HBFNet, for mmWave channel estimation and hybrid beamforming (HBF) design, respectively. The number of parameters for channel estimation is reduced by using channel covariance matrix (CCM) estimation instead. However, a new challenge of estimating high-dimensional data from low-dimensional data should be considered since the dimension of Sub-6G channel data is much smaller than that of mmWave. Subsequently, a data deformation approach is introduced into the framework to match the size of Sub-6G channel data with that of mmWave. The simulation results show that the application of statistical channel information based on Sub-6G channel information to aid mmWave communication is reasonable and effective, it achieves good estimation performance and spectral efficiency. Moreover, the two-stage cascaded network architecture proposed in this paper is also more robust to channel estimation errors.","2473-2400","","10.1109/TGCN.2024.3359208","National Key Research and Development Program of China(grant numbers:2018YFB1802004); Higher Education Discipline Innovation Project(grant numbers:B08038); ","https://ieeexplore.ieee.org/stamp/stamp.jsp?arnumber=10415870","Millimeter-wave communication;hybrid beamforming;channel covariance estimation;Sub-6G aided;deep learning","Millimeter wave communication;Radio frequency;Channel estimation;Estimation;Array signal processing;Transmitters;6G mobile communication;Array signal processing;Deep learning","","2","","51","IEEE","29 Jan 2024","","","IEEE","IEEE Journals"
"DRL-Based Resource Allocation and Trajectory Planning for NOMA-Enabled Multi-UAV Collaborative Caching 6G Network","P. Qin; Y. Fu; J. Zhang; S. Geng; J. Liu; X. Zhao","North China Electric Power University, Beijing, China; North China Electric Power University, Beijing, China; China Academic of Electronics and Information Technology, Beijing, China; North China Electric Power University, Beijing, China; North China Electric Power University, Beijing, China; North China Electric Power University, Beijing, China",IEEE Transactions on Vehicular Technology,"19 Jun 2024","2024","73","6","8750","8764","Aerialplatform-based network has been invoked as an appealing assistance for terrestrial cellular networks. Caching at edge UAVs is an effective emerging solution for relieving the wireless backhaul congestion and reducing content fetching latency for hotspot areas. This article investigates a non-orthogonal multiple access (NOMA)-enabled multi-UAV collaborative caching network, where the multimedia contents are delivered from UAVs to ground users. UAVs cache popular contents and collaboratively share with each other. The optimization problem of joint caching decision, 3D trajectory planning and spectrum resource allocation is formulated for minimizing the system content retrieving delay. It is an NP-hard mixed integer nonconvex optimization issue with extra difficulty that the content popularity is highly dynamic. To tackle this challenging problem, we decouple the original issue into two subproblems: (1) UAV collaborative caching decision making and (2) joint optimization of UAV trajectory planning, power allocation, and channel reusing. We develop a multi-agent proximal policy optimization (MAPPO)-based algorithm for the former to achieve the maximum weighted content hit ratio and propose a matching-DRL solution for the latter. Numerical evaluations confirm that the proposed approach is capable of rapid convergence and achieves superior performance in terms of content hit ratio, content retrieving delay, and system throughput compared to other benchmark algorithms.","1939-9359","","10.1109/TVT.2024.3357086","National Natural Science Foundation of China(grant numbers:62201212); Natural Science Foundation of Hebei Province(grant numbers:F2022502017); Fundamental Research Funds for the Central Universities(grant numbers:2023JC003); Baoding Fundamental Research Project(grant numbers:2272P003); National Key Research and Development Program of China(grant numbers:2021YFB2900500); ","https://ieeexplore.ieee.org/stamp/stamp.jsp?arnumber=10412167","Multi-UAV collaborative caching 6G network;resource allocation;UAV trajectory planning;NOMA;deep reinforcement learning (DRL)","Autonomous aerial vehicles;Resource management;NOMA;Optimization;Collaboration;Trajectory;Delays","","7","","44","IEEE","23 Jan 2024","","","IEEE","IEEE Journals"
